{
  "schemaVersion": 1,
  "slug": "llm-adaptation-and-runtime",
  "roleSlug": "llm-engineer",
  "series": {"slug":"llm-engineering","title":"LLM Engineering"},
  "volume": 2,
  "title": "LLM Adaptation and Runtime",
  "subtitle": "Data, Post-Training, Inference, and Model Change",
  "description": "A professional guide to evidence-led model adaptation, data design, post-training, runtime qualification, and reversible change.",
  "author": "Komal Nakrani",
  "language": "en",
  "status": "draft",
  "cover": "blueprint",
  "edition": {"version":"1.0.0","label":"First edition draft","publishedAt":null,"copyrightYear":2026,"canonicalUrl":"https://komalnakrani.com/books/llm-adaptation-and-runtime/"},
  "chapters": [
    {"order":1,"slug":"start-from-a-frozen-behavior-baseline","title":"Start From a Frozen Behavior Baseline","summary":"Turn a negative adaptation referral into a falsifiable investigation anchored to an exact, replayable behavior baseline.","minutes":95,"sourceFile":"chapters/start-from-a-frozen-behavior-baseline.mdx","objectiveIds":["LLME-K03","LLME-K06","LLME-K08","LLME-K10"]},
    {"order":2,"slug":"inspect-the-model-and-tokenizer-boundary","title":"Inspect the Model and Tokenizer Boundary","summary":"Inspect model, tokenizer, template, precision, and runtime as separate compatibility surfaces without turning architecture into a quality forecast.","minutes":95,"sourceFile":"chapters/inspect-the-model-and-tokenizer-boundary.mdx","objectiveIds":["LLME-K02","LLME-K03","LLME-K07","LLME-K09"]},
    {"order":3,"slug":"choose-the-smallest-adaptation-ladder","title":"Choose the Smallest Adaptation Ladder","summary":"Map each residual failure to the smallest plausible intervention, reject mismatched methods, and attach disconfirmation and stop rules before training.","minutes":100,"sourceFile":"chapters/choose-the-smallest-adaptation-ladder.mdx","objectiveIds":["LLME-K03","LLME-K07","LLME-K08","LLME-K09","LLME-K10"]},
    {"order":4,"slug":"specify-the-data-recipe","title":"Specify the Data Recipe","summary":"Turn a conditional adaptation hypothesis into a reproducible, authority-aware data recipe before collecting or transforming examples.","minutes":100,"sourceFile":"chapters/specify-the-data-recipe.mdx","objectiveIds":["LLME-K07","LLME-K10"]},
    {"order":5,"slug":"curate-deduplicate-and-separate","title":"Curate, Deduplicate, and Separate","summary":"Execute the data recipe as an auditable pipeline that preserves rejected records, detects indirect overlap, and freezes purpose-separated dataset vaults.","minutes":105,"sourceFile":"chapters/curate-deduplicate-and-separate.mdx","objectiveIds":["LLME-K06","LLME-K07","LLME-K10"]},
    {"order":6,"slug":"build-instruction-and-demonstration-data","title":"Build Instruction and Demonstration Data","summary":"Turn clean synthetic partitions into evidence-linked, template-correct instruction records with intentional loss regions and visible coverage gaps.","minutes":105,"sourceFile":"chapters/build-instruction-and-demonstration-data.mdx","objectiveIds":["LLME-K07","LLME-K08"]},
    {"order":7,"slug":"build-preference-and-feedback-data","title":"Build Preference and Feedback Data","summary":"Turn comparative judgments into criterion-specific, randomized, bias-audited evidence without treating preference as truth.","minutes":105,"sourceFile":"chapters/build-preference-and-feedback-data.mdx","objectiveIds":["LLME-K06","LLME-K07","LLME-K08","LLME-K10"]},
    {"order":8,"slug":"preserve-retention-and-control-cases","title":"Preserve Retention and Control Cases","summary":"Freeze target, retention, multilingual, abstention, safety, and no-change lanes so adaptation cannot hide forbidden regressions.","minutes":105,"sourceFile":"chapters/preserve-retention-and-control-cases.mdx","objectiveIds":["LLME-K06","LLME-K07","LLME-K10"]},
    {"order":9,"slug":"establish-the-training-experiment","title":"Establish the Training Experiment","summary":"Specify an inspectable, resumable training experiment whose state, resources, behavioral hooks, and stop rules are frozen before execution.","minutes":110,"sourceFile":"chapters/establish-the-training-experiment.mdx","objectiveIds":["LLME-K07","LLME-K08","LLME-K09"]},
    {"order":10,"slug":"supervise-the-model","title":"Supervise the Model","summary":"Separate supervised token optimization from held-out behavior evidence, then select or reject checkpoints across target, retention, language, control, and resource slices.","minutes":110,"sourceFile":"chapters/supervise-the-model.mdx","objectiveIds":["LLME-K07","LLME-K08"]},
    {"order":11,"slug":"adapt-efficiently-with-peft","title":"Adapt Efficiently With PEFT","summary":"Evaluate low-rank adapters as traceable behavior-and-resource candidates whose base, tokenizer, template, runtime, quantization, and merge state must remain compatible.","minutes":110,"sourceFile":"chapters/adapt-efficiently-with-peft.mdx","objectiveIds":["LLME-K07","LLME-K08","LLME-K09"]},
    {"order":12,"slug":"optimize-preferences-carefully","title":"Optimize Preferences Carefully","summary":"Treat preference optimization as a bounded proxy experiment whose value must survive independent target, retention, language, control, and bias evaluation.","minutes":115,"sourceFile":"chapters/optimize-preferences-carefully.mdx","objectiveIds":["LLME-K06","LLME-K07","LLME-K08","LLME-K10"]},
    {"order":13,"slug":"decide-on-distillation-or-continued-pretraining","title":"Decide on Distillation or Continued Pretraining","summary":"Choose advanced adaptation only when its mechanism, transfer source, authority, and disconfirming evidence match a distinct residual gap.","minutes":110,"sourceFile":"chapters/decide-on-distillation-or-continued-pretraining.mdx","objectiveIds":["LLME-K02","LLME-K07","LLME-K08","LLME-K09"]},
    {"order":14,"slug":"package-and-version-the-model-system","title":"Package and Version the Model System","summary":"Bind every behavior-facing component, lineage link, compatibility result, limitation, and rollback state into one fail-closed release identity.","minutes":110,"sourceFile":"chapters/package-and-version-the-model-system.mdx","objectiveIds":["LLME-K07","LLME-K09","LLME-K10","LLME-K11"]},
    {"order":15,"slug":"reason-about-inference-memory-and-throughput","title":"Reason About Inference Memory and Throughput","summary":"Build a workload-specific resource model that separates weights, KV state, prefill, decode, concurrency, throughput, and latency tails.","minutes":115,"sourceFile":"chapters/reason-about-inference-memory-and-throughput.mdx","objectiveIds":["LLME-K02","LLME-K09","LLME-K12"]}
  ],
  "registries": {"sources":"sources.json","claims":"claims.json","figures":"figures.json","errata":"errata.json"},
  "pdf": {"enabled":false,"filename":"llm-adaptation-and-runtime-v1.0.0.pdf"}
}
