{
  "schemaVersion": 1,
  "slug": "applied-ai-engineering",
  "roleSlug": "applied-ai-engineer",
  "series": {"slug":"applied-ai-engineering","title":"Applied AI Engineering"},
  "volume": 1,
  "title": "Applied AI Engineering",
  "subtitle": "From Model Capability to Dependable Product Behavior",
  "description": "A practical field book for turning uncertain model capability into useful, measurable, reliable, and governable product behavior through a continuous evidence loop.",
  "author": "Komal Nakrani",
  "language": "en",
  "status": "draft",
  "cover": "ink",
  "edition": {"version":"1.0.0","label":"First edition draft","publishedAt":null,"copyrightYear":2026,"canonicalUrl":"https://komalnakrani.com/books/applied-ai-engineering/"},
  "chapters": [
    {"order":1,"slug":"behavior-not-magic","title":"Behavior, Not Magic","summary":"Establish product behavior as the unit of accountability and build a responsibility charter around a recursive evidence loop.","minutes":45,"sourceFile":"chapters/behavior-not-magic.mdx","objectiveIds":["AAE-K01","AAE-K02","AAE-K11"]},
    {"order":2,"slug":"start-with-the-user-task","title":"Start With the User Task","summary":"Turn a request for AI into a falsifiable task, consequence, baseline, value hypothesis, evidence log, and valid stop path.","minutes":55,"sourceFile":"chapters/start-with-the-user-task.mdx","objectiveIds":["AAE-K01","AAE-K02","AAE-K08","AAE-K11"]},
    {"order":3,"slug":"write-the-behavior-contract","title":"Write the Behavior Contract","summary":"Specify required, uncertain, abstaining, escalating, degraded, and prohibited behavior with explicit evidence and authority.","minutes":60,"sourceFile":"chapters/write-the-behavior-contract.mdx","objectiveIds":["AAE-K01","AAE-K02","AAE-K06","AAE-K08"]},
    {"order":4,"slug":"choose-the-simplest-adequate-mechanism","title":"Choose the Simplest Adequate Mechanism","summary":"Compare deterministic, retrieval, predictive, multimodal, generative, agentic, and hybrid mechanisms against the behavior contract and select the least complex adequate path.","minutes":65,"sourceFile":"chapters/choose-the-simplest-adequate-mechanism.mdx","objectiveIds":["AAE-K01","AAE-K03","AAE-K07","AAE-K08"]},
    {"order":5,"slug":"make-task-data-representative","title":"Make Task Data Representative","summary":"Build a permitted, versioned task-data substrate whose population, provenance, labels, segments, leakage, missingness, and limitations can support or reduce the behavior claim.","minutes":70,"sourceFile":"chapters/make-task-data-representative.mdx","objectiveIds":["AAE-K04","AAE-K06","AAE-K08"]},
    {"order":6,"slug":"engineer-context-and-retrieval","title":"Engineer Context and Retrieval","summary":"Design an authorized context path that separates query transformation, candidate generation, ranking, permission, freshness, assembly, provenance, and empty or conflicting evidence behavior.","minutes":75,"sourceFile":"chapters/engineer-context-and-retrieval.mdx","objectiveIds":["AAE-K03","AAE-K04","AAE-K06","AAE-K07","AAE-K08"]},
    {"order":7,"slug":"draw-the-combined-system-boundary","title":"Draw the Combined System Boundary","summary":"Separate learned behavior, deterministic policy, application state, trust, failure, ownership, and authority so every consequential claim crosses validation before use.","minutes":80,"sourceFile":"chapters/draw-the-combined-system-boundary.mdx","objectiveIds":["AAE-K02","AAE-K03","AAE-K05","AAE-K08"]},
    {"order":8,"slug":"build-an-inspectable-vertical-slice","title":"Build an Inspectable Vertical Slice","summary":"Implement one production-shaped behavior path that succeeds, abstains, fails safely, exposes evidence, and runs locally without provider secrets.","minutes":85,"sourceFile":"chapters/build-an-inspectable-vertical-slice.mdx","objectiveIds":["AAE-K04","AAE-K05","AAE-K07","AAE-K08"]},
    {"order":9,"slug":"turn-consequences-into-evaluation-cases","title":"Turn Consequences Into Evaluation Cases","summary":"Build a versioned evaluation set whose cases, segments, provenance, ambiguity, coverage, splits, leakage controls, and limits map to the behavior contract.","minutes":80,"sourceFile":"chapters/turn-consequences-into-evaluation-cases.mdx","objectiveIds":["AAE-K02","AAE-K04","AAE-K06","AAE-K08"]},
    {"order":10,"slug":"name-the-errors-that-matter","title":"Name the Errors That Matter","summary":"Classify errors by consequence, segment, severity, detectability, reversibility, and control, then choose thresholds and release dispositions without hiding critical failures behind an average.","minutes":80,"sourceFile":"chapters/name-the-errors-that-matter.mdx","objectiveIds":["AAE-K01","AAE-K02","AAE-K06","AAE-K08"]},
    {"order":11,"slug":"combine-machine-human-and-domain-judgment","title":"Combine Machine, Human, and Domain Judgment","summary":"Assign each system claim to deterministic checks, references, calibrated graders, trained raters, specialists, or accountable authorities without laundering agreement into truth.","minutes":80,"sourceFile":"chapters/combine-machine-human-and-domain-judgment.mdx","objectiveIds":["AAE-K02","AAE-K06","AAE-K08"]},
    {"order":12,"slug":"run-experiments-that-change-decisions","title":"Run Experiments That Change Decisions","summary":"Preregister reproducible comparisons that isolate a change, preserve paired cases, segments, guardrails, confounds, and negative evidence, and end in an explicit disposition.","minutes":85,"sourceFile":"chapters/run-experiments-that-change-decisions.mdx","objectiveIds":["AAE-K03","AAE-K06","AAE-K09"]},
    {"order":13,"slug":"design-for-probabilistic-failure","title":"Design for Probabilistic Failure","summary":"Model failure by layer, consequence, propagation, and state, then contain it with bounded retries, idempotency, circuits, degradation, reconciliation, and explicit recovery evidence.","minutes":85,"sourceFile":"chapters/design-for-probabilistic-failure.mdx","objectiveIds":["AAE-K02","AAE-K05","AAE-K07","AAE-K08"]},
    {"order":14,"slug":"budget-latency-capacity-and-cost","title":"Budget Latency, Capacity, and Cost","summary":"Turn user time, tail latency, concurrency, capacity, retries, cache semantics, quality, and total cost into a segment-preserving product envelope.","minutes":80,"sourceFile":"chapters/budget-latency-capacity-and-cost.mdx","objectiveIds":["AAE-K03","AAE-K05","AAE-K07"]},
    {"order":15,"slug":"observe-behavior-without-betraying-users","title":"Observe Behavior Without Betraying Users","summary":"Build decision-bearing signals, redacted traces, feedback paths, retention controls, and diagnostic views that reveal product behavior without routine raw-content surveillance.","minutes":85,"sourceFile":"chapters/observe-behavior-without-betraying-users.mdx","objectiveIds":["AAE-K04","AAE-K07","AAE-K08","AAE-K09"]},
    {"order":16,"slug":"implement-controls-and-preserve-authority","title":"Implement Controls and Preserve Authority","summary":"Translate threats and harms into implemented, tested, monitored controls with explicit residual limits, qualified review, and named authority.","minutes":90,"sourceFile":"chapters/implement-controls-and-preserve-authority.mdx","objectiveIds":["AAE-K02","AAE-K04","AAE-K05","AAE-K07","AAE-K08"]},
    {"order":17,"slug":"release-to-learn-safely","title":"Release to Learn Safely","summary":"Match exposure to the next justified uncertainty with versioned readiness evidence, restricted cohorts, explicit stop triggers, and rehearsed rollback authority.","minutes":85,"sourceFile":"chapters/release-to-learn-safely.mdx","objectiveIds":["AAE-K06","AAE-K07","AAE-K08","AAE-K09"]},
    {"order":18,"slug":"diagnose-real-use-and-incidents","title":"Diagnose Real Use and Incidents","summary":"Contain consequence, reconstruct layered evidence, test and disconfirm hypotheses, protect sensitive traces, verify recovery, and change durable artifacts.","minutes":90,"sourceFile":"chapters/diagnose-real-use-and-incidents.mdx","objectiveIds":["AAE-K06","AAE-K07","AAE-K08","AAE-K09"]},
    {"order":19,"slug":"change-models-without-losing-the-product","title":"Change Models Without Losing the Product","summary":"Inventory, replay, compare, release, and roll back model or provider change against an unchanged product behavior contract.","minutes":90,"sourceFile":"chapters/change-models-without-losing-the-product.mdx","objectiveIds":["AAE-K03","AAE-K06","AAE-K07","AAE-K10"]},
    {"order":20,"slug":"earn-reuse-from-repeated-evidence","title":"Earn Reuse From Repeated Evidence","summary":"Separate reusable mechanisms from local evidence and authority, validate stable seams across consumers, and reject abstractions that have not earned their blast radius.","minutes":80,"sourceFile":"chapters/earn-reuse-from-repeated-evidence.mdx","objectiveIds":["AAE-K03","AAE-K06","AAE-K08","AAE-K10"]},
    {"order":21,"slug":"lead-applied-ai-decisions","title":"Lead Applied AI Decisions","summary":"Direct attention across unlike systems, communicate at the right altitude, preserve evidence and authority, and grow by improving the decisions and people around the work.","minutes":80,"sourceFile":"chapters/lead-applied-ai-decisions.mdx","objectiveIds":["AAE-K01","AAE-K06","AAE-K08","AAE-K09","AAE-K10"]}
  ],
  "registries": {"sources":"sources.json","claims":"claims.json","figures":"figures.json","errata":"errata.json"},
  "pdf": {"enabled":false,"filename":"applied-ai-engineering-v1.0.0.pdf"}
}
