{
  "schemaVersion": 1,
  "slug": "llm-behavior-engineering",
  "roleSlug": "llm-engineer",
  "series": {"slug":"llm-engineering","title":"LLM Engineering"},
  "volume": 1,
  "title": "LLM Behavior Engineering",
  "subtitle": "Contracts, Context, Retrieval, and Evaluation",
  "description": "A professional guide to making language-model behavior explicit, grounded, measurable, and change-ready across managed and open-weight systems.",
  "author": "Komal Nakrani",
  "language": "en",
  "status": "draft",
  "cover": "indigo",
  "edition": {"version":"1.0.0","label":"First edition draft","publishedAt":null,"copyrightYear":2026,"canonicalUrl":"https://komalnakrani.com/books/llm-behavior-engineering/"},
  "chapters": [
    {"order":1,"slug":"the-model-is-not-the-behavior","title":"The Model Is Not the Behavior","summary":"Separate a model response from configured system behavior, outcome evidence, and accountable human authority.","minutes":65,"sourceFile":"chapters/the-model-is-not-the-behavior.mdx","objectiveIds":["LLME-K01","LLME-K12"]},
    {"order":2,"slug":"write-the-language-task-contract","title":"Write the Language-Task Contract","summary":"Turn an ambiguous language feature into measurable states, consequences, non-goals, escalation, and named decision authority.","minutes":75,"sourceFile":"chapters/write-the-language-task-contract.mdx","objectiveIds":["LLME-K01","LLME-K10"]},
    {"order":3,"slug":"reason-about-tokens-attention-and-generation","title":"Reason About Tokens, Attention, and Generation","summary":"Use bounded mechanism knowledge to predict token, template, context, and decoding failure surfaces without anthropomorphism.","minutes":80,"sourceFile":"chapters/reason-about-tokens-attention-and-generation.mdx","objectiveIds":["LLME-K02","LLME-K04"]},
    {"order":4,"slug":"select-a-model-and-access-posture","title":"Select a Model and Access Posture","summary":"Choose a reversible model and access path from task evidence, hard constraints, responsibility, and lifecycle risk.","minutes":80,"sourceFile":"chapters/select-a-model-and-access-posture.mdx","objectiveIds":["LLME-K03","LLME-K09","LLME-K10"]},
    {"order":5,"slug":"establish-a-reproducible-baseline","title":"Establish a Reproducible Baseline","summary":"Bind every behavior-facing input and version into a replayable baseline with raw evidence, trials, and explicit unknowns.","minutes":85,"sourceFile":"chapters/establish-a-reproducible-baseline.mdx","objectiveIds":["LLME-K03","LLME-K04","LLME-K06"]},
    {"order":6,"slug":"engineer-instructions-and-messages","title":"Engineer Instructions and Messages","summary":"Build a versioned message interface that keeps trusted control separate from untrusted data and tests instruction changes by ablation.","minutes":90,"sourceFile":"chapters/engineer-instructions-and-messages.mdx","objectiveIds":["LLME-K04","LLME-K06","LLME-K10"]},
    {"order":7,"slug":"make-outputs-typed-and-bounded","title":"Make Outputs Typed and Bounded","summary":"Turn generated language into a versioned proposal interface with layered validation, provenance checks, and explicit terminal states.","minutes":90,"sourceFile":"chapters/make-outputs-typed-and-bounded.mdx","objectiveIds":["LLME-K01","LLME-K04","LLME-K09","LLME-K10"]},
    {"order":8,"slug":"budget-context-deliberately","title":"Budget Context Deliberately","summary":"Allocate finite context among control, authorized evidence, history, and output while making every omission and failure state visible.","minutes":90,"sourceFile":"chapters/budget-context-deliberately.mdx","objectiveIds":["LLME-K02","LLME-K04","LLME-K06"]},
    {"order":9,"slug":"design-the-retrieval-question","title":"Design the Retrieval Question","summary":"Decide whether external evidence is needed and specify authority, permission, freshness, evidence units, and no-evidence behavior before choosing retrieval technology.","minutes":90,"sourceFile":"chapters/design-the-retrieval-question.mdx","objectiveIds":["LLME-K01","LLME-K05","LLME-K10"]}
  ],
  "registries": {"sources":"sources.json","claims":"claims.json","figures":"figures.json","errata":"errata.json"},
  "pdf": {"enabled":false,"filename":"llm-behavior-engineering-v1.0.0.pdf"}
}
