{
  "schemaVersion": 1,
  "slug": "forward-deployed-engineering",
  "roleSlug": "forward-deployed-engineer",
  "series": {
    "slug": "forward-deployed-engineering",
    "title": "Forward Deployed Engineering"
  },
  "volume": 1,
  "title": "Forward Deployed Engineering",
  "subtitle": "From Ambiguous Workflow to Production Outcome",
  "description": "A practical field book for converting ambiguous customer workflows into secure, adopted, supportable production systems and reusable product learning.",
  "author": "Komal Nakrani",
  "language": "en",
  "status": "draft",
  "cover": "blueprint",
  "edition": {
    "version": "1.0.0",
    "label": "First edition draft",
    "publishedAt": null,
    "copyrightYear": 2026,
    "canonicalUrl": "https://komalnakrani.com/books/forward-deployed-engineering/"
  },
  "chapters": [
    {
      "order": 1,
      "slug": "the-deployed-outcome",
      "title": "The Deployed Outcome",
      "summary": "Define the Forward Deployed Engineer's unit of accountability, lifecycle, role boundary, and evidence-based meaning of done.",
      "minutes": 45,
      "sourceFile": "chapters/the-deployed-outcome.mdx",
      "objectiveIds": ["FDE-K01", "FDE-K11", "FDE-K12"]
    },
    {
      "order": 2,
      "slug": "enter-the-customer-system",
      "title": "Enter the Customer System",
      "summary": "Plan legitimate discovery, distinguish stakeholder dimensions, minimize access and data, and keep evidence confidence explicit.",
      "minutes": 50,
      "sourceFile": "chapters/enter-the-customer-system.mdx",
      "objectiveIds": ["FDE-K01", "FDE-K02", "FDE-K08", "FDE-K12"]
    },
    {
      "order": 3,
      "slug": "map-the-workflow-that-actually-exists",
      "title": "Map the Workflow That Actually Exists",
      "summary": "Model actors, decisions, state, data, tools, handoffs, incentives, exceptions, and failure cost without idealizing the current workflow.",
      "minutes": 55,
      "sourceFile": "chapters/map-the-workflow-that-actually-exists.mdx",
      "objectiveIds": ["FDE-K02", "FDE-K03", "FDE-K06"]
    },
    {
      "order": 4,
      "slug": "contract-for-an-outcome",
      "title": "Contract for an Outcome",
      "summary": "Turn workflow evidence into measurable outcomes, guardrails, adoption signals, decision rights, assumptions, non-goals, and exit criteria.",
      "minutes": 55,
      "sourceFile": "chapters/contract-for-an-outcome.mdx",
      "objectiveIds": ["FDE-K01", "FDE-K02", "FDE-K03", "FDE-K10", "FDE-K12"]
    },
    {
      "order": 5,
      "slug": "scope-the-first-safe-production-path",
      "title": "Scope the First Safe Production Path",
      "summary": "Select the least exposed end-to-end path that produces representative production evidence with explicit dependencies, uncertainty, change, and stop criteria.",
      "minutes": 55,
      "sourceFile": "chapters/scope-the-first-safe-production-path.mdx",
      "objectiveIds": ["FDE-K02", "FDE-K03", "FDE-K04", "FDE-K08", "FDE-K12"]
    },
    {
      "order": 6,
      "slug": "draw-the-real-system-boundary",
      "title": "Draw the Real System Boundary",
      "summary": "Express structural, runtime, data, trust, failure, and responsibility boundaries with explicit ownership and architecture decisions.",
      "minutes": 60,
      "sourceFile": "chapters/draw-the-real-system-boundary.mdx",
      "objectiveIds": ["FDE-K03", "FDE-K04", "FDE-K08", "FDE-K09"]
    }
  ],
  "registries": {
    "sources": "sources.json",
    "claims": "claims.json",
    "figures": "figures.json",
    "errata": "errata.json"
  },
  "pdf": {
    "enabled": true,
    "filename": "forward-deployed-engineering-v1.0.0.pdf"
  }
}
