{
  "schemaVersion": 1,
  "slug": "pipeline-verification",
  "roleSlug": "pipeline-verification",
  "series": { "slug": "pipeline-tests", "title": "Pipeline Tests" },
  "volume": 1,
  "title": "Publication Pipeline Verification",
  "subtitle": "A non-production proof of deterministic web and PDF delivery",
  "description": "A fixture that proves fresh canonical manuscripts can be validated, traced, rendered, and checksummed without entering the public catalog.",
  "author": "Komal Nakrani",
  "language": "en",
  "status": "published",
  "cover": "blueprint",
  "edition": {
    "version": "1.0.0",
    "label": "Verification edition",
    "publishedAt": "2026-08-16",
    "copyrightYear": 2026,
    "canonicalUrl": "https://komalnakrani.com/books/pipeline-verification/"
  },
  "chapters": [
    {
      "order": 1,
      "slug": "one-source",
      "title": "One canonical source",
      "summary": "Why web and PDF editions must originate from the same reviewed manuscript.",
      "minutes": 4,
      "sourceFile": "chapters/one-source.mdx",
      "objectiveIds": ["PV-O01"]
    },
    {
      "order": 2,
      "slug": "release-evidence",
      "title": "Release evidence",
      "summary": "How editions, registries, checksums, and errata make a publication auditable.",
      "minutes": 4,
      "sourceFile": "chapters/release-evidence.mdx",
      "objectiveIds": ["PV-O02"]
    }
  ],
  "registries": { "sources": "sources.json", "claims": "claims.json", "figures": "figures.json", "errata": "errata.json" },
  "pdf": { "enabled": true, "filename": "pipeline-verification-v1.0.0.pdf" }
}
